"Profile Picture","Name","Login ID","SIS ID","Section","Role","Last Activity","Total Activity","Administrative Links"
"Julian Azfar Bin Muhammad Adil","Julian Azfar Bin Muhammad Adil","azfarbij@erau.edu","2628629","1011","Teacher","Jan 23 at 8:45pm","07:02:05","Manage Julian Azfar Bin Muhammad Adil"
"Luca Alberto Castagneri","Luca Alberto Castagneri","castagl2@my.erau.edu","2697363","1011","Student","Jan 23 at 12:26am","02:01:44","Manage Luca Alberto Castagneri"
"Daryl Raj Chander","Daryl Raj Chander","chanderd@my.erau.edu","2736262","1011","Student","Jan 25 at 12:01am","05:36:55","Manage Daryl Raj Chander"
"Bulathwelage Nethma Udara Dharmawansa","Bulathwelage Nethma Udara Dharmawansa","dharmawn@my.erau.edu","2729820","1011","Student","Jan 22 at 10:10pm","01:45:32","Manage Bulathwelage Nethma Udara Dharmawansa"
"Denzil Dsouza","Denzil Dsouza","dsouzad4@my.erau.edu","2725680","1011","Student","Jan 25 at 3:37am","01:52:24","Manage Denzil Dsouza"
"Natac Jan Angela Carpio","Natac Jan Angela Carpio","natacj@my.erau.edu","2692253","1011","Student","Jan 26 at 7:25am","02:45:11","Manage Natac Jan Angela Carpio"
"Prabhav Mathur","Prabhav Mathur","mathurp1@my.erau.edu","2693116","1011","Student","Jan 26 at 12:18am","01:02:15","Manage Prabhav Mathur"
"Leonhard Valentim Ziegenhorn","Leonhard Valentim Ziegenhorn","valentl2@my.erau.edu","2739768","1011","Student","Jan 22 at 10:07pm","01:10:35","Manage Leonhard Valentim Ziegenhorn"
"Siti Adriana Zahirah Binte Zulkiffli","Siti Adriana Zahirah Binte Zulkiffli","zulkiffs@my.erau.edu","2727144","1011","Student","Jan 24 at 2:47am","02:12:53","Manage Siti Adriana Zahirah Binte Zulkiffli"